{
  "format_version": 1,
  "legacy_semantic_sha256": "74c9ed1e345a0c67ca7878a25c7aa73a89f36298c1ca6071a5343cf48dd4c4a1",
  "operation_count": 59,
  "operations": [
    {
      "name": "product.help",
      "schema_version": 1,
      "target_kind": {
        "custom": "product.surface"
      },
      "access": "read",
      "risk": "safe",
      "reversibility": "reversible",
      "required": {
        "fields": []
      },
      "required_any": [],
      "planning": "unsupported",
      "progress": "unsupported",
      "cancellation": "unsupported",
      "verification": "unsupported",
      "fanout": "unsupported",
      "retry": "safe",
      "idempotent": false,
      "evidence": [
        "configuration"
      ],
      "requirements": [
        "product.help"
      ]
    },
    {
      "name": "docker.info",
      "schema_version": 1,
      "target_kind": "docker_daemon",
      "access": "read",
      "risk": "safe",
      "reversibility": "reversible",
      "required": {
        "fields": []
      },
      "required_any": [],
      "planning": "unsupported",
      "progress": "unsupported",
      "cancellation": "unsupported",
      "verification": "unsupported",
      "fanout": "unsupported",
      "retry": "safe",
      "idempotent": false,
      "evidence": [
        "runtime_state"
      ],
      "requirements": [
        "runtime.docker"
      ]
    },
    {
      "name": "docker.df",
      "schema_version": 1,
      "target_kind": "docker_daemon",
      "access": "read",
      "risk": "safe",
      "reversibility": "reversible",
      "required": {
        "fields": []
      },
      "required_any": [],
      "planning": "unsupported",
      "progress": "unsupported",
      "cancellation": "unsupported",
      "verification": "unsupported",
      "fanout": "unsupported",
      "retry": "safe",
      "idempotent": false,
      "evidence": [
        "metrics",
        "runtime_state"
      ],
      "requirements": [
        "runtime.docker"
      ]
    },
    {
      "name": "docker.images",
      "schema_version": 1,
      "target_kind": "docker_daemon",
      "access": "read",
      "risk": "safe",
      "reversibility": "reversible",
      "required": {
        "fields": []
      },
      "required_any": [],
      "planning": "unsupported",
      "progress": "unsupported",
      "cancellation": "unsupported",
      "verification": "unsupported",
      "fanout": "unsupported",
      "retry": "safe",
      "idempotent": false,
      "evidence": [
        "configuration",
        "runtime_state"
      ],
      "requirements": [
        "runtime.docker"
      ]
    },
    {
      "name": "docker.networks",
      "schema_version": 1,
      "target_kind": "docker_daemon",
      "access": "read",
      "risk": "safe",
      "reversibility": "reversible",
      "required": {
        "fields": []
      },
      "required_any": [],
      "planning": "unsupported",
      "progress": "unsupported",
      "cancellation": "unsupported",
      "verification": "unsupported",
      "fanout": "unsupported",
      "retry": "safe",
      "idempotent": false,
      "evidence": [
        "configuration",
        "runtime_state"
      ],
      "requirements": [
        "runtime.docker"
      ]
    },
    {
      "name": "docker.volumes",
      "schema_version": 1,
      "target_kind": "docker_daemon",
      "access": "read",
      "risk": "safe",
      "reversibility": "reversible",
      "required": {
        "fields": []
      },
      "required_any": [],
      "planning": "unsupported",
      "progress": "unsupported",
      "cancellation": "unsupported",
      "verification": "unsupported",
      "fanout": "unsupported",
      "retry": "safe",
      "idempotent": false,
      "evidence": [
        "configuration",
        "runtime_state"
      ],
      "requirements": [
        "runtime.docker"
      ]
    },
    {
      "name": "docker.pull",
      "schema_version": 1,
      "target_kind": "image",
      "access": "mutation",
      "risk": "safe",
      "reversibility": "conditional",
      "required": {
        "fields": [
          "host",
          "image"
        ]
      },
      "required_any": [],
      "planning": "optional",
      "progress": "required",
      "cancellation": "optional",
      "verification": "required",
      "fanout": "unsupported",
      "retry": "safe",
      "idempotent": true,
      "evidence": [
        "artifact",
        "logs",
        "runtime_state"
      ],
      "requirements": [
        "runtime.docker"
      ]
    },
    {
      "name": "docker.build",
      "schema_version": 1,
      "target_kind": "image",
      "access": "mutation",
      "risk": "privileged",
      "reversibility": "conditional",
      "required": {
        "fields": [
          "context",
          "host",
          "tag"
        ]
      },
      "required_any": [],
      "planning": "required",
      "progress": "required",
      "cancellation": "optional",
      "verification": "required",
      "fanout": "unsupported",
      "retry": "never",
      "idempotent": false,
      "evidence": [
        "artifact",
        "logs",
        "runtime_state"
      ],
      "requirements": [
        "filesystem.read",
        "runtime.docker"
      ]
    },
    {
      "name": "docker.rmi",
      "schema_version": 1,
      "target_kind": "image",
      "access": "mutation",
      "risk": "destructive",
      "reversibility": "conditional",
      "required": {
        "fields": [
          "force",
          "host",
          "image"
        ]
      },
      "required_any": [],
      "planning": "required",
      "progress": "optional",
      "cancellation": "optional",
      "verification": "required",
      "fanout": "unsupported",
      "retry": "conditional",
      "idempotent": true,
      "evidence": [
        "diff",
        "runtime_state"
      ],
      "requirements": [
        "runtime.docker"
      ]
    },
    {
      "name": "docker.prune",
      "schema_version": 1,
      "target_kind": "docker_daemon",
      "access": "mutation",
      "risk": "destructive",
      "reversibility": "irreversible",
      "required": {
        "fields": [
          "force",
          "host",
          "prune_target"
        ]
      },
      "required_any": [],
      "planning": "required",
      "progress": "optional",
      "cancellation": "optional",
      "verification": "required",
      "fanout": "unsupported",
      "retry": "never",
      "idempotent": false,
      "evidence": [
        "diff",
        "runtime_state"
      ],
      "requirements": [
        "runtime.docker"
      ]
    },
    {
      "name": "container.list",
      "schema_version": 1,
      "target_kind": "docker_daemon",
      "access": "read",
      "risk": "safe",
      "reversibility": "reversible",
      "required": {
        "fields": []
      },
      "required_any": [],
      "planning": "unsupported",
      "progress": "unsupported",
      "cancellation": "unsupported",
      "verification": "unsupported",
      "fanout": "unsupported",
      "retry": "safe",
      "idempotent": false,
      "evidence": [
        "runtime_state"
      ],
      "requirements": [
        "runtime.docker"
      ]
    },
    {
      "name": "container.inspect",
      "schema_version": 1,
      "target_kind": "container",
      "access": "read",
      "risk": "safe",
      "reversibility": "reversible",
      "required": {
        "fields": [
          "container_id"
        ]
      },
      "required_any": [],
      "planning": "unsupported",
      "progress": "unsupported",
      "cancellation": "unsupported",
      "verification": "unsupported",
      "fanout": "unsupported",
      "retry": "safe",
      "idempotent": false,
      "evidence": [
        "configuration",
        "runtime_state"
      ],
      "requirements": [
        "runtime.docker"
      ]
    },
    {
      "name": "container.logs",
      "schema_version": 1,
      "target_kind": "container",
      "access": "read",
      "risk": "safe",
      "reversibility": "reversible",
      "required": {
        "fields": [
          "container_id"
        ]
      },
      "required_any": [],
      "planning": "unsupported",
      "progress": "optional",
      "cancellation": "optional",
      "verification": "unsupported",
      "fanout": "unsupported",
      "retry": "safe",
      "idempotent": false,
      "evidence": [
        "logs"
      ],
      "requirements": [
        "runtime.docker"
      ]
    },
    {
      "name": "container.stats",
      "schema_version": 1,
      "target_kind": "docker_daemon",
      "access": "read",
      "risk": "safe",
      "reversibility": "reversible",
      "required": {
        "fields": []
      },
      "required_any": [],
      "planning": "unsupported",
      "progress": "optional",
      "cancellation": "optional",
      "verification": "unsupported",
      "fanout": "unsupported",
      "retry": "safe",
      "idempotent": false,
      "evidence": [
        "metrics",
        "runtime_state"
      ],
      "requirements": [
        "runtime.docker"
      ]
    },
    {
      "name": "container.top",
      "schema_version": 1,
      "target_kind": "container",
      "access": "read",
      "risk": "safe",
      "reversibility": "reversible",
      "required": {
        "fields": [
          "container_id"
        ]
      },
      "required_any": [],
      "planning": "unsupported",
      "progress": "unsupported",
      "cancellation": "unsupported",
      "verification": "unsupported",
      "fanout": "unsupported",
      "retry": "safe",
      "idempotent": false,
      "evidence": [
        "runtime_state"
      ],
      "requirements": [
        "runtime.docker"
      ]
    },
    {
      "name": "container.search",
      "schema_version": 1,
      "target_kind": "docker_daemon",
      "access": "read",
      "risk": "safe",
      "reversibility": "reversible",
      "required": {
        "fields": [
          "query"
        ]
      },